1,Mauris Sagittis Limited,552-5165 Ac Road,Davenport,OR,588351983,6475260437,donec@google.org,http://naver.com,Ainsley Wilder,ac orci.
2,Magna Industries,458-6542 Interdum. Street,Pike Creek,OH,344254726,5036198108,egestas@icloud.couk,https://facebook.com,Wyoming Morse,"tempus non, lacinia at, iaculis quis, pede. Praesent eu dui."
3,Sed LLC,9646 Pharetra Ave,Virginia Beach,FL,665554276,2607675753,id.enim@yahoo.couk,http://youtube.com,Kamal Lawson,felis. Nulla tempor augue ac ipsum. Phasellus
4,Mollis Dui Institute,5435 Proin Street,Lowell,MD,381486502,4639186131,eu.dolor.egestas@outlook.ca,http://zoom.us,Emma Rosales,Phasellus dapibus quam quis diam. Pellentesque habitant morbi
5,Eu Institute,"Ap #962-5594 Ut, St.",Topeka,CT,723121148,7202239759,neque@icloud.edu,http://wikipedia.org,Pascale Meadows,sit amet orci. Ut sagittis lobortis mauris. Suspendisse
6,Fringilla Euismod Industries,"P.O. Box 824, 8573 In St.",Akron,NE,537745717,6297765481,ut@protonmail.ca,http://ebay.com,Chantale Wolf,at arcu. Vestibulum ante ipsum primis in faucibus orci luctus
7,Non Corporation,9694 Ante Street,Boston,LA,054324025,7225780343,auctor.vitae@outlook.net,https://walmart.com,George Hahn,et netus et malesuada fames ac
8,Non Egestas A LLC,"Ap #915-2479 At, Road",Great Falls,FL,154285194,4466618835,posuere@google.edu,http://bbc.co.uk,Denise Douglas,"Etiam laoreet, libero et"
